{
  "$schema": "http://json-schema.org/draft-07/schema#",
  "title": "APISensor",
  "type": "object",
  "properties": {
    "_id": {
      "type": "string",
      "description": "The unique identifier for the API sensor data"
    },
    "recording_id": {
      "type": "string",
      "description": "Reference to the recording this sensor data belongs to"
    },
    "sensor_location": {
      "type": "string",
      "description": "The location where the sensor is placed (e.g., bag, hand, hips, torso)",
      "enum": ["bag", "hand", "hips", "torso"]
    },
    "api_confidence": {
      "type": "array",
      "description": "Array of API confidence readings over time",
      "items": {
        "type": "object",
        "properties": {
          "timestamp": { "type": "number", "description": "Timestamp in milliseconds" },
          "still_confidence": { "type": "number", "description": "Confidence for still activity (0-100%)" },
          "on_foot_confidence": { "type": "number", "description": "Confidence for on foot activity (0-100%)" },
          "walking_confidence": { "type": "number", "description": "Confidence for walking activity (0-100%)" },
          "running_confidence": { "type": "number", "description": "Confidence for running activity (0-100%)" },
          "on_bicycle_confidence": { "type": "number", "description": "Confidence for on bicycle activity (0-100%)" },
          "in_vehicle_confidence": { "type": "number", "description": "Confidence for in vehicle activity (0-100%)" },
          "tilting_confidence": { "type": "number", "description": "Confidence for tilting activity (0-100%)" },
          "unknown_confidence": { "type": "number", "description": "Confidence for unknown activity (0-100%)" }
        },
        "required": [
          "timestamp",
          "still_confidence",
          "on_foot_confidence",
          "walking_confidence",
          "running_confidence",
          "on_bicycle_confidence",
          "in_vehicle_confidence",
          "tilting_confidence",
          "unknown_confidence"
        ]
      }
    }
  },
  "required": ["_id", "recording_id", "sensor_location", "api_confidence"]
}
